Sheet: Foglio1
A1: Gestione Scorte di Magazzino
A3: Descrizione ARTICOLO | B3: Prezzo | C3: Quantità | D3: Valore | E3: Scorta Minima | F3: Scorta Max | G3: Q.tà Ordine | H3: Corso Ordine | I3: Q.tà eccedente | J3: Capitale Fermo
A4: A | B4: 30 | C4: 200 | D4: of:=PRODUCT([.B4];[.C4]) -> 6000 | E4: 350 | F4: 1500 | G4: of:=IF(Quantita<scorta_minima;scorta_minima-Quantita;" ") -> 150 | H4: of:=IF([.G4]<>" ";[.G4]*[.B4];" ") -> 4500 | I4: of:=IF([.C4]>[.F4];[.C4]-[.F4];" ") ->  | J4: of:=IF([.I4]<>" ";[.I4]*[.B4];" ") -> 
A5: B | B5: 45 | C5: 8500 | D5: of:=PRODUCT([.B5];[.C5]) -> 382500 | E5: 30 | F5: 100 | G5: of:=IF(Quantita<scorta_minima;scorta_minima-Quantita;" ") ->  | H5: of:=IF([.G5]<>" ";[.G5]*[.B5];" ") ->  | I5: of:=IF([.C5]>[.F5];[.C5]-[.F5];" ") -> 8400 | J5: of:=IF([.I5]<>" ";[.I5]*[.B5];" ") -> 378000
A6: C | B6: 1500 | C6: 500 | D6: of:=PRODUCT([.B6];[.C6]) -> 750000 | E6: 1200 | F6: 4000 | G6: of:=IF(Quantita<scorta_minima;scorta_minima-Quantita;" ") -> 700 | H6: of:=IF([.G6]<>" ";[.G6]*[.B6];" ") -> 1050000 | I6: of:=IF([.C6]>[.F6];[.C6]-[.F6];" ") ->  | J6: of:=IF([.I6]<>" ";[.I6]*[.B6];" ") -> 
A7: D | B7: 10 | C7: 55000 | D7: of:=PRODUCT([.B7];[.C7]) -> 550000 | E7: 5 | F7: 20 | G7: of:=IF(Quantita<scorta_minima;scorta_minima-Quantita;" ") ->  | H7: of:=IF([.G7]<>" ";[.G7]*[.B7];" ") ->  | I7: of:=IF([.C7]>[.F7];[.C7]-[.F7];" ") -> 54980 | J7: of:=IF([.I7]<>" ";[.I7]*[.B7];" ") -> 549800
A8: E | B8: 7000 | C8: 10 | D8: of:=PRODUCT([.B8];[.C8]) -> 70000 | E8: 3000 | F8: 5000 | G8: of:=IF(Quantita<scorta_minima;scorta_minima-Quantita;" ") -> 2990 | H8: of:=IF([.G8]<>" ";[.G8]*[.B8];" ") -> 20930000 | I8: of:=IF([.C8]>[.F8];[.C8]-[.F8];" ") ->  | J8: of:=IF([.I8]<>" ";[.I8]*[.B8];" ") -> 
A9: F | B9: 8000 | C9: 6 | D9: of:=PRODUCT([.B9];[.C9]) -> 48000 | E9: 5000 | F9: 7000 | G9: of:=IF(Quantita<scorta_minima;scorta_minima-Quantita;" ") -> 4994 | H9: of:=IF([.G9]<>" ";[.G9]*[.B9];" ") -> 39952000 | I9: of:=IF([.C9]>[.F9];[.C9]-[.F9];" ") ->  | J9: of:=IF([.I9]<>" ";[.I9]*[.B9];" ") -> 
A10: G | B10: 450 | C10: 300 | D10: of:=PRODUCT([.B10];[.C10]) -> 135000 | E10: 300 | F10: 1000 | G10: of:=IF(Quantita<scorta_minima;scorta_minima-Quantita;" ") ->  | H10: of:=IF([.G10]<>" ";[.G10]*[.B10];" ") ->  | I10: of:=IF([.C10]>[.F10];[.C10]-[.F10];" ") ->  | J10: of:=IF([.I10]<>" ";[.I10]*[.B10];" ") -> 
A11: H | B11: 2350 | C11: 35 | D11: of:=PRODUCT([.B11];[.C11]) -> 82250 | E11: 3000 | F11: 6000 | G11: of:=IF(Quantita<scorta_minima;scorta_minima-Quantita;" ") -> 2965 | H11: of:=IF([.G11]<>" ";[.G11]*[.B11];" ") -> 6967750 | I11: of:=IF([.C11]>[.F11];[.C11]-[.F11];" ") ->  | J11: of:=IF([.I11]<>" ";[.I11]*[.B11];" ") -> 
A12: I | B12: 5500 | C12: 120 | D12: of:=PRODUCT([.B12];[.C12]) -> 660000 | E12: 1000 | F12: 2000 | G12: of:=IF(Quantita<scorta_minima;scorta_minima-Quantita;" ") -> 880 | H12: of:=IF([.G12]<>" ";[.G12]*[.B12];" ") -> 4840000 | I12: of:=IF([.C12]>[.F12];[.C12]-[.F12];" ") ->  | J12: of:=IF([.I12]<>" ";[.I12]*[.B12];" ") -> 
A13: J | B13: 150 | C13: 5000 | D13: of:=PRODUCT([.B13];[.C13]) -> 750000 | E13: 50 | F13: 4000 | G13: of:=IF(Quantita<scorta_minima;scorta_minima-Quantita;" ") ->  | H13: of:=IF([.G13]<>" ";[.G13]*[.B13];" ") ->  | I13: of:=IF([.C13]>[.F13];[.C13]-[.F13];" ") -> 1000 | J13: of:=IF([.I13]<>" ";[.I13]*[.B13];" ") -> 150000
A14: K | B14: 700 | C14: 3500 | D14: of:=PRODUCT([.B14];[.C14]) -> 2450000 | E14: 500 | F14: 1500 | G14: of:=IF(Quantita<scorta_minima;scorta_minima-Quantita;" ") ->  | H14: of:=IF([.G14]<>" ";[.G14]*[.B14];" ") ->  | I14: of:=IF([.C14]>[.F14];[.C14]-[.F14];" ") -> 2000 | J14: of:=IF([.I14]<>" ";[.I14]*[.B14];" ") -> 1400000
A18: Valore del Magazzino | B18: Generi in difetto | C18: Costo Ordine | D18: Generi in Eccesso | E18: Capitale fermo
A20: of:=SUM([.D4:.D14]) -> 5883750 | B20: of:=COUNT([.G4:.G14]) -> 6 | C20: of:=SUM([.H4:.H14]) -> 73744250 | D20: of:=COUNT([.I4:.I14]) -> 4 | E20: of:=SUM([.J4:.J14]) -> 2477800